77	9		【キャラクターの性格ついて】	以下の実装されたキャラクターで<br>【性格】が好みだったキャラクターを選択してください。<br>（複数選択可）	checkV	"特になし|★6 ムスカリ|★5 カリブラコア|★5 アルメリア|★6 コフェア|★5 ブルーベリー|★5 メランポジューム|★6 アオキ"	
78	9		【キャラクターのデザインついて】	以下の実装されたキャラクターで<br>【デザイン】が好みだったキャラクターを選択してください。<br>（複数選択可）	checkV	"特になし|★6 ムスカリ|★5 カリブラコア|★5 アルメリア|★6 コフェア|★5 ブルーベリー|★5 メランポジューム|★6 アオキ"	
79	9		【キャラクターのSDアニメーションついて】	以下の実装されたキャラクターで<br>【SDアニメーション】が好みだったキャラクターを選択してください。<br>（複数選択可）	checkV	"特になし|★6 ムスカリ|★5 カリブラコア|★5 アルメリア|★6 コフェア|★5 ブルーベリー|★5 メランポジューム|★6 アオキ"	
80	9		【緊急任務シナリオについて】	緊急任務「来たれ！スイーツの友」のシナリオについての評価で<br>次の選択肢から当てはまるものを選択してください。	radioV	とても良かった|まあまあ良かった|あまり良くなかった|良くなかった|読んでいない	
81	9	80		緊急任務「憧れをファッションに込めて」のシナリオについての評価で<br>次の選択肢から当てはまるものを選択してください。	radioV	とても良かった|まあまあ良かった|あまり良くなかった|良くなかった|読んでいない	
82	9	80		「こんなシナリオを見てみたい」という意見がありましたら<br>自由にご記入ください。	text		
83	9	80		過去実施されたシナリオで良かったもの、印象深いものなどありましたら<br>タイトルや理由など自由にご記入ください。	text		
